{
  "schemaVersion": "akm.eval.config.v1",
  "run": {
    "id": "longmemeval-smoke",
    "outputDir": "runs/longmemeval-smoke"
  },
  "packs": [
    {
      "id": "longmemeval",
      "adapter": "longmemeval",
      "enabled": true,
      "config": {
        "smoke": true,
        "maxQuestions": 10,
        "questionCategories": ["single-session", "multi-session"]
      }
    }
  ],
  "variants": [
    {
      "id": "baseline",
      "agent": { "provider": "none" },
      "akm": { "enabled": false },
      "memory": { "backend": "none" }
    },
    {
      "id": "akm-memory",
      "agent": { "provider": "opencode", "providerRef": "opencode", "model": "gpt-4.1-mini" },
      "akm": { "enabled": true, "command": "akm" },
      "memory": { "backend": "akm", "config": { "command": "akm memory" } }
    }
  ],
  "providers": {
    "opencode": {
      "type": "opencode",
      "configPath": "config/opencode.json",
      "defaultModel": "opencode/gpt-4.1-mini"
    }
  },
  "judging": { "enabled": true, "provider": "openai", "model": "gpt-4.1-mini", "temperature": 0 },
  "telemetry": { "trackTokens": true, "trackCost": true, "trackLatency": true, "captureLogs": true }
}
