{
  "schemaVersion": "akm.eval.config.v1",
  "run": {
    "id": "terminal-bench-shredder-qwen",
    "outputDir": "runs/terminal-bench-shredder-qwen",
    "maxConcurrency": 1,
    "timeoutMs": 1800000
  },
  "packs": [
    {
      "id": "terminal-bench",
      "adapter": "terminal-bench",
      "enabled": true,
      "config": {
        "smoke": true,
        "taskIds": ["hello-world"],
        "nConcurrent": 1,
        "nAttempts": 1,
        "dataset": "terminal-bench-core==0.1.1"
      }
    }
  ],
  "variants": [
    {
      "id": "baseline",
      "agent": { "provider": "opencode", "providerRef": "shredder", "model": "shredder/qwen/qwen3.5-9b" },
      "akm": { "enabled": false },
      "memory": { "backend": "none" }
    }
  ],
  "providers": {
    "shredder": {
      "type": "opencode",
      "configPath": "config/opencode.shredder.json",
      "defaultModel": "shredder/qwen/qwen3.5-9b"
    }
  },
  "judging": { "enabled": false },
  "telemetry": { "trackTokens": true, "trackCost": true, "trackLatency": true, "captureLogs": true }
}
